{
  "protocolVersion": 2,
  "drawingId": "44444444-4444-4444-8444-444444444444",
  "runId": "55555555-5555-4555-8555-555555555555",
  "image": "H4sIAAAAAAAAA/NIzcnJVyjPL8pJUQQAlRmFGwwAAAA=",
  "coordinateSpace": {
    "width": 4961,
    "height": 3508
  },
  "assignmentMethod": "llm",
  "output": {
    "includeScaleAndLengths": true
  }
}
